Вопрос,Ответ1,Ответ2,Ответ3,Ответ4,Правильный
Какие силы в Сопротивлении материалов рассматриваются при расчете напряжений в элементах конструкции?,Аксиальные,Радиальные,Тангенциальные,Поперечные,0
Что такое модуль упругости?,Отношение напряжения к деформации,Температурное расширение,Плотность материала,Коэффициент теплопроводности,0
Какая формула используется для расчета изгибающего момента в балке?,M = F * d,М = P * A,М = E * I / L^2,М = σ * A,0
Какой закон описывает распределение напряжений в поперечном сечении балки при изгибе?,Закон Гука,Закон Паскаля,Закон Архимеда,Закон Ферма,0
Какой фактор безопасности следует использовать при проектировании конструкций из сопротивляющих материалов?,Фактор безопасности,Коэффициент надежности,Критерий безопасности,Индекс безопасности,0

